pid	Verbal Report	cat_score_high	cat_score_low	cat_score_med	cat_cost_high	cat_cost_low	cat_cost_med
0	I determined which ending had the most to offer and snaked my way down to which path had the highest reward.	0	0	1	0	1	0
1	Looking for the most green trails. Stayed away from the high red numbers	0	0	1	0	0	1
4	In L-shaped patterns.	0	1	0	1	0	0
5	I Mainly just started with the four center circles and if I saw a +12/+20 I would keep going down that path and if i saw a -12/20 i switched to the others. If a path gave me a total of above 20 I usually stopped searching.	1	0	0	0	1	0
6	Choosing just a few points and finding what I thought was a positive dollar path	1	0	0	0	0	1
7	I chose routes with most money	0	1	0	0	0	1
9	I planned as a circle and when it didn't work for me I started back over or at least tried to make it as close as I could.	0	0	1	0	0	1
10	Clicked a couple times to see if there were any huge negatives in general directions before moving	0	1	0	1	0	0
11	I clicked all the first stops first. From there I followed the most dollar amount. If I encountered any -$20 I stopped. I followed the path of 'green only' when possible. If there was an all green path before I looked at all the amounts, I usually took it. 	0	1	0	0	1	0
12	check value of the 4 directions you can go, chose the one that was worth the most and try to avoid any deductions.	0	0	1	0	0	1
13	I looked at the first circle amount then went from there.	1	0	0	0	0	1
15	At first I didn't have a good strategy.  I then realized that I needed to find out more information in order to make the best route possible.  	1	0	0	0	0	1
16	Assessing the net gain for each route	0	1	0	0	1	0
17	I didn't plan. I went with gut instincts I guess.	0	1	0	1	0	0
18	First, I selected the first four paths. Out of the ones that had the highest amounts, I selected the rest of the path to see which ones would yield the most profit.	0	0	1	0	0	1
19	I looked at the values for the end decision, then looked at the initial decision to find the higher value	0	0	1	0	1	0
20	I checked the circumference first and tried to find a positive number. Then I went from there looking for more positives.	1	0	0	0	0	1
21	By the amount of money avaliable	0	1	0	0	1	0
23	On some I just guessed and some I clicked to see what the amount was. Either way it was kinda a guess	0	1	0	0	0	1
24	There was a problem with choosing the right arrow even though I switched keyboards	1	0	0	1	0	0
25	Well I clicked on the closest circle and would plan to check the values of the circles that had positive numbers, especially larger ones. I would check multiple positive circles to find the best routes.	0	0	1	0	1	0
26	I tried following the positive amounts in the inner ring, but that didn't work. After that I just moved at random.	1	0	0	1	0	0
27	At first it was purely random. Then I did go in a pattern that appeared to be successful	1	0	0	1	0	0
28	I like consistency and sticking with what I know.	0	1	0	0	1	0
29	checked to see which way paid more and if I found a twenty spot I went that way	0	1	0	0	1	0
30	based on the most money offered	0	0	1	0	1	0
31	guessed	0	0	1	1	0	0
33	I finally started flipping the direction	0	1	0	0	0	1
34	I clicked on different points to plan the best stratehy	0	0	1	1	0	0
35	I prefer to know all the possibilities and facts so I gave away money in order to know the facts. I first choice the route away from the base then clicked on the routes that paid the most while taking away the lest. Sometimes this worked, many times it didn't.	0	1	0	0	0	1
36	I tried to reveal the least amount of hints so I wouldn't have to pay too much for the information. I stop revealing the hints when I felt like I had a good enough idea which path to go (as opposed to revealing every spot).	0	0	1	0	1	0
37	showed the first steps to see if that could give me a hint as to what way I should go. but no good	0	1	0	1	0	0
38	going up or forward seemed to work best most of the time. I thought there was a possible pattern	0	1	0	0	1	0
39	I looked for the highest positive within the first two steps, then looked for a 12 or 20 in the final spot	1	0	0	0	0	1
40	I clicked on enough routes to make sure I would have a fairly accurate idea of the values.	0	0	1	0	0	1
41	Trying to find the best route by luck	0	1	0	0	0	1
42	I looked for the routes that had high net values	0	0	1	0	1	0
43	I tried to guess based on the other routes that were done. 	1	0	0	1	0	0
44	Random.	0	1	0	0	0	1
46	I didn't have a strategy.  I just hoped for the best.	0	1	0	0	1	0
48	i guessed most of the time. I did not have a special route planned. Just guessed and tried to figure out which route was best.	0	1	0	0	1	0
49	Of course I tried to pick the route that I thought would make the biggest profit.	0	0	1	0	0	1
50	i'd would click on the closest circles first and then plan on which route i'd take by going towards the best 2nd circle i'd see. 	1	0	0	0	1	0
51	at first i clicked on everything to see where to make the most money.	0	1	0	0	1	0
52	I looked to see which route would earn me the most money. 	0	0	1	0	1	0
53	I wanted to see the cost of the first flight on all of them then where I'd end	1	0	0	0	0	1
54	I picked the route with the most money	0	1	0	0	1	0
55	I could not find any rhyme or reason to any of it so i just tried to choose the best route after revealing a few amounts	0	1	0	1	0	0
56	I checked the value of each stop and then planned the route that would earn the highest (or lose the least).	1	0	0	0	1	0
57	Rather than waste money uncovering ALL of the routes to know the best route, I only uncovered 3 out of the first 4 nodes. If one of those nodes was positive then it would be better to take it then waste money on the final uncovered node. Then I would uncover the nodes in the positive routes from there and which had the highest values at that point I would then uncover the final two, thereby maximizing the money I would make for my chosen route.	1	0	0	0	1	0
58	Predicted where the highest money was likely to be based on previous rounds	1	0	0	1	0	0
59	Look to see if first circle was positive. If positive I went to that one first. If negative I checked another	1	0	0	1	0	0
61	At first I thought all red/negative were a bad move, so it took me a moment to figure out it's about the total sum.	0	1	0	0	0	1
62	Initially, just randomly went. Later, looked at random path and if value of path exceeded cost of peeking, took it.	1	0	0	0	0	1
63	I chose to view the payout of each final option, and then went to the highest payout... usually.	0	1	0	0	1	0
64	I started with the four initial routes to see which would give the most money, then looked at the other routes from there.	1	0	0	0	0	1
65	I tried to guess which route would be the best through clicking the closest tiles to the center.	0	1	0	0	1	0
66	I checked the first amount for all the directions. Then based on that checked the following amounts only to one direction or at most two. 	0	0	1	0	1	0
67	I followed positives until I hit a negative. 	0	0	1	0	1	0
68	guessed	0	1	0	1	0	0
69	Completely random, as i noticed all directions gave different results each round.	0	1	0	0	0	1
70	figured the most profitable path	0	0	1	0	1	0
71	I chose the route that would earn the most money.	1	0	0	0	1	0
72	Sometimes I used the hints by clicking on the next step, otherwise I just randomly chose a path.	0	0	1	1	0	0
73	i just relied on my own instinct regardless if i chose wrong 	0	1	0	0	0	1
74	opening as many as possible	0	0	1	0	1	0
75	by seeing which beginning way to start by the cost	1	0	0	1	0	0
76	I mostly looked at the end results of each route because ending on a positive number is a good idea.	0	0	1	0	0	1
77	I began at the end of the route and find one that was profitable and work my way in. If I could find one that was revenue of $20 and one another that was positive, I did not have to click the third circle as I knew the overall route was going to be profitable	1	0	0	0	0	1
78	I tried to look at the ending prices 	0	1	0	0	1	0
79	I checked to see what the 2nd circle would be, if it would benefit or hurt me,  then checked one side of each of the T shapes, and decided from there	1	0	0	0	1	0
80	I was looking to see which final stop had the best money	1	0	0	1	0	0
81	I revealed most of the amounts and chose the route.	0	0	1	0	0	1
82	I started off randomly with the intent of finding the values of all the circles.  Once I determined that positive generally netted more positive, I tested it a couple of times and then I continued with the positive.	1	0	0	0	1	0
83	I would typically start with uncovering the $ of one of the inner 4 circles. If it was green I would click on one of the circles at the end of that route. If that circle was +12 or +20, I'd go for it. If not, I'd click on the other destination circle. I'd then go for whichever had a higher positive number. If neither were positive, I'd be at a loss and venture out randomly or bite the bullet. 	1	0	0	0	0	1
84	It was imperative that i made the most informed first move so I at least revealed the amount for the first four moves on each round. 	1	0	0	0	1	0
85	Try and guess the best first layer, then find the best final destination.	1	0	0	1	0	0
86	Seeing if there were any patterns forming, then trying them out.	0	1	0	0	1	0
87	I was not exactly sure how to plan the route but just kind of went in any direction that was having it go forward.	0	1	0	1	0	0
88	I tried to pick atleast one so i would know if it was worth going that way or not	1	0	0	1	0	0
89	Best overall payout found, hopefully without revealing all the numbers	0	0	1	0	1	0
90	looking for positive numbers	1	0	0	0	0	1
92	i guessed	0	0	1	1	0	0
93	Random	0	1	0	0	0	1
95	I chose to reveal the closest options to the center. if any of those were negative, I ruled them out of my 'flight plan'. if any of them were positive, I revealed the end destination to determine which endpoint was better. 	1	0	0	0	1	0
96	Checking the value of my moves	0	1	0	1	0	0
97	Stayed away from negative amounts for the most part	1	0	0	0	1	0
98	I clicked on several amounts and chose the route that appeared most beneficial.	0	1	0	0	0	1
99	I would gather as much information as possible before moving in order to lose less in the end.	1	0	0	0	0	1
100	Trying to determine best first decision and then ending location since I needed to pass through intermediate location either way.	0	1	0	1	0	0
101	I tested the first level each time and then the second level based on the best payout on the first level.  Based on that I checked the final destination.  If the amounts were close I checked several paths.  I tried not to spend more than I needed	1	0	0	0	0	1
102	just guessing	0	1	0	0	0	1
103	Followed my first instinct	1	0	0	1	0	0
104	/i tried tofind the maximum amount of money 	0	0	1	0	0	1
105	I tried to find what paid the most.	0	0	1	0	0	1
106	I decided to wing it.	0	1	0	0	0	1
108	I typically picked one or two of the original hubs and went with the higher amount.	0	1	0	1	0	0
109	Assess each of the first steps in each route, then, using those values, eliminating the routes which risked the most loss of money and further assessing the remaining routes until discovering the best path to take.	0	0	1	0	0	1
110	I did not check prices before hand, I chose directions at random	0	1	0	1	0	0
111	it was difficult.	0	1	0	1	0	0
112	I tried to choose different routes than the negative one before.	0	1	0	1	0	0
115	By calculating which route would make the the most amount of money with the least amount of clicks.	1	0	0	0	1	0
116	I tried to deduce what path would gain a profit as soon as possible	0	1	0	0	0	1
117	I just picked what I felt in my gut most the time, tried using some probability of where the negative numbers might be.	0	1	0	0	1	0
118	I chose to reveal the end of the routes and go that way if there was a positive sum of money	0	0	1	1	0	0
119	Tried to look at the best route, and follow it.	0	1	0	0	1	0
120	I was looking for the most money to be collected on my route	1	0	0	0	1	0
121	At first I looked at the inner routes, choosing one and going off of that. Then I shifted to the final outer destinations. After consistently having bad luck, I gave up with wasting $4 every guess.	0	1	0	1	0	0
122	played the guessing game	0	1	0	1	0	0
123	guessing	0	1	0	1	0	0
124	Just went for the same route every time.	0	1	0	0	0	1
125	I tried to take each route at least once whether or not I had lost money on the route before.	0	1	0	0	1	0
126	Check the prices beneath the closest NSEW circles. For any positives, check the next respective circles. Whichever yields a larger profit, click the left and/or right circle(s) to determine which was the best route.	1	0	0	0	1	0
127	I previewed some of the spots to determine the better routes.	0	1	0	0	1	0
128	I tried to maximize profit.	0	0	1	0	1	0
129	I first clicked on a circle adjacent/closest to the plane as there are only four of those options, and the pane will have to travel through one of those four paths before they branch out. At first, I focused more on risk taking. Later in the game, I focused more on preserving the bonus I had accumulated.	0	0	1	0	0	1
130	By choosing certain destinations to understand what the probable amount of the final destination would be	0	1	0	0	1	0
131	At first, I just revealed all locations to see what the earnings were, then went for the most earnings.  Then, I decided to try not to lose 10 cents by not choosing so many locations, once I saw that the opening spots were + or -	1	0	0	0	1	0
132	I didn't do much planning, This game was not fun at all.	0	1	0	1	0	0
133	I did the 4 immediately around the airplane first then decided where to go based on whichever was the highest amount	1	0	0	0	0	1
134	I found the route that had the highest positive value and then the secondary stop with the highest value and followed that route.	1	0	0	0	0	1
135	Tried to pick a destination that payed out positive.	0	0	1	1	0	0
136	At first I clicked every route. 	0	0	1	0	1	0
137	i performed using a typical route	0	1	0	0	1	0
138	Poorly, as it turned out.  Because it was random, I had assumed that sticking to the same route was the best option.  Then I wavered.  	0	1	0	0	1	0
139	I was just looking for the highest pay on the way	1	0	0	0	0	1
140	I randomly clicked through the routes. If I found a bad route I went to it again. If I found a good route, I left it and tried another. 	0	1	0	0	1	0
141	I tried to use my choices wisely.	0	1	0	0	0	1
142	I checked to see the best route 	0	1	0	0	1	0
143	I honest couldn't figure out a good pattern.	1	0	0	1	0	0
144	I revealed which directions I should travel by what had the largest payout.	1	0	0	0	1	0
145	I just went with what felt right	0	1	0	0	0	1
146	Sometimes I would reveal the value, other times I would just take a chance.	1	0	0	1	0	0
147	randomly. 	0	1	0	0	0	1
150	Reveal the closest circles first. Then reveal the circles after the highest closest ones. then repeat for the last circles.	0	0	1	0	0	1
151	I would click the first one then see if it was a plus or minus. 	1	0	0	0	1	0
152	just random	0	1	0	0	0	1
153	At first I tried to come up with a plan, but it did not seem to work so I ended up just guessing and hoping for the best.  Obviously that did not work well either!  	0	0	1	1	0	0
154	Going for altitude and maybe forward, moving as a plane would move	0	1	0	1	0	0
156	I checked the inner spots first to see which had the higher/lower payout and then went from there.	0	0	1	0	0	1
157	Started with the closest circles, then plotted out the most promising routes	0	0	1	0	1	0
158	random	0	1	0	0	1	0
159	I clicked on the final destinations first. When I found a positive number (especially if it was 12 or 20), I would start tracing back to the starting point to see how profitable the overall trip would be. I would then pick which one I either thought or knew was the most profitable.	1	0	0	0	1	0
160	I looked for the most money, I focused on positive paths first and saw what the best path was	0	0	1	0	1	0
161	took path that started with positive number	0	0	1	0	0	1
162	Tried to estimate what would make me gain the most using the least clues	0	0	1	0	0	1
163	I looked at the values and picked the values that would gain me more money. 	1	0	0	0	1	0
165	I clicked on the amounts. 	0	1	0	0	1	0
167	I chose and end point and if it was positive I took my chances getting there. If it was negative I went the other direction.	1	0	0	1	0	0
168	looking for highest value in squares closest	0	0	1	0	1	0
169	To reveal the amount of each location then looking for most positive route.	0	0	1	0	1	0
170	I tried to maximize my winnings.	1	0	0	1	0	0
171	Randomized it as best as I could	0	1	0	1	0	0
172	At first I picked randomly but after several rounds I decided to plan to go in the northwest direction every time rotating counter-clockwise in each consecutive round.	1	0	0	1	0	0
173	tried to make the most money	1	0	0	1	0	0
175	I first uncovered the values of all the destinations one hop away from the start. From there, I followed paths of positive values first. If I hit upon a path with all positive values that seemed high, I usually stopped uncovering values and chose that route. If all the initial nodes showed negative or low positive values, it was usually necessary to uncover many more nodes before making a decision.	1	0	0	0	1	0
177	I looked for a certain profit.	1	0	0	0	1	0
178	I generally tried to go up first	0	1	0	0	1	0
179	Attempted to see if the final destination was positive enough to be worth it.	1	0	0	1	0	0
180	I would check in all directions, and chose the best	0	0	1	0	0	1
181	it should be at least minimally profitable	1	0	0	1	0	0
182	By finding the route that gave the most money to start out and then click from there to find the best path.	1	0	0	0	1	0
183	clicking last circle at end and beginning circ	0	0	1	0	1	0
184	As soon as I uncovered a route then ended with a positive total I took it.	1	0	0	0	0	1
185	I tried to gather as much information as possible to determine what route would be optimal by revealing the monetary values.	0	1	0	0	1	0
186	looked for positive values	1	0	0	0	1	0
187	based on the ultimate reward	0	1	0	1	0	0
188	If one route gave me more I'd take that route again but the values always changed. 	0	0	1	1	0	0
189	I tried to see if the route paid.	0	1	0	1	0	0
191	picked a couple of endpoints to reveal value.	0	0	1	1	0	0
193	i would click the closest route first then guess from there as it would cost too much to reveal anything after 	0	0	1	1	0	0
195	I just guessed	0	0	1	1	0	0
196	looked for $20s or the highest amount and went in that direction	0	0	1	1	0	0
197	At first I tried to just uncover the first stops of the plane to decide in which direction to go, but then as I went on, I went with uncovering more to try and find the highest value and least negatives.	0	0	1	0	1	0
198	I generally paid extra to view the last stops and see their values.  Then I worked inward, paying to see earlier stops to try to find the most advantageous route.  	1	0	0	0	0	1
199	I tried to decide which route would give me the best gain on the first move.	0	0	1	0	0	1
201	I found a direction that earned a decent amount and stuck with it until the amount earned became negative.	0	1	0	0	0	1
202	revealed endpoints, and paths along the way to greatest rewards	1	0	0	0	1	0
203	random choice	0	1	0	1	0	0
204	At first I just guessed, because I didn't want to have to pay $4.00	0	1	0	1	0	0
205	I initially didn't check the amount of the route and was blindly moving. I then decided to take the hit to my bonus to see the right path where I could gain. It worked briefly but I felt it was still by chance as each move was a coin toss after the first move.	0	1	0	0	1	0
206	I just clicked to I found a positive number	0	0	1	0	0	1
207	I just picked a direction and went with it.	1	0	0	1	0	0
209	Mostly trying to quickly find a profitable route without incurring information costs	1	0	0	0	0	1
210	I always tried to pick the best first move and hoped for the best from there.	1	0	0	0	0	1
212	I used intuition, poorly.	0	0	1	1	0	0
213	chose the route that I thought would give me the best bonus	1	0	0	0	1	0
214	I looked for an optimum destination and tried to reach it as cheaply as possible	0	1	0	1	0	0
216	Tried to identify most profitable first trip/	0	0	1	1	0	0
217	I would click on a single circle and depending on my route plan around that.	1	0	0	1	0	0
218	I tried to find path that started with a net gain, and then hoped for the best	1	0	0	1	0	0
219	Mostly at random 	0	1	0	0	1	0
220	Well, at first I was doing them randomly. Then I began forming an idea of doing them diagonally. 	0	1	0	0	0	1
222	guessing instead of wasting $4 for worthless info	0	0	1	1	0	0
223	By choosing the path that got me the most money	1	0	0	0	0	1
224	At first it took me longer.	0	0	1	0	1	0
225	At first it was to check the beginnings of each route, then check the ends of the best, but it became apparent quite quickly that this was counterproductive.  From then it was mostly just checking until I found a decent start, then checking the ends, which was okay but very easily ruined by bad luck when picking.	1	0	0	1	0	0
226	I checked one of the four routes to see if it was a large negative, then I guessed one of the remaining three and hoped for the best.	0	1	0	0	0	1
227	Guessing where to go and hoping for the best. 	1	0	0	1	0	0
228	I didn't. I really didn't understand what was going on with this, even after reading the directions.	0	1	0	0	1	0
229	Good guessing honestly 	0	0	1	1	0	0
230	I searched all 4 of the starting points and then uncovered the path of the starting points with positive values until i found one that ended up with the most positive sum.	1	0	0	0	1	0
231	I looked at the areas with the highest price attached.	0	0	1	0	0	1
232	I tried to not repeat my moves.	0	0	1	1	0	0
233	trying to calculate the most in profit 	1	0	0	0	0	1
234	highest next to beginning then checked one over	0	0	1	0	0	1
236	Not really since planning only helps if there are patterns	0	1	0	0	1	0
237	I checked the first four circles around the plane chose the two circles with the highest amounts. I then checked both of those circles destination circles and took the route that had the highest destination amount.	1	0	0	0	0	1
238	I would look at prices for 2 routes and choose the best one.	0	0	1	0	1	0
239	If there were two green numbers and they added up to bring my negative to a positive then I went that route. 	1	0	0	0	0	1
240	trying different methods never came to a real system i do believe the amounts did have some type of planned rotation tho	0	1	0	0	1	0
242	I clicked all four of the first choices and then usually clicked two choices from those.	1	0	0	0	0	1
243	Sometimes I just went with my gut feeling. Other times I liked to click on one of the outer numbers to see how much I could earn. Mostly I think I was trying to avoid losing money so I tried not to check the amounts too much.	0	0	1	0	0	1
244	I started with positive routes and explored only as far as I needed to to gain a profit. 	0	0	1	0	1	0
245	By Expectation .	0	0	1	1	0	0
246	Tried to find the least expensive and highest paying without spending too much money before. 	0	0	1	0	0	1
247	I plan by not going the same way and mixing and varying the direction I would select. 	0	1	0	0	0	1
248	by trying to maximize loss and increase my gains	0	0	1	0	0	1
249	I looked at highest final values and then sometimes check the route to see if it was good or bad on the way	1	0	0	0	0	1
250	Checking the one or 2 options fron the first move	0	1	0	0	1	0
251	I would have to select the destinations to see what would end in a positive outcome. After seeing the (+) amounts, I was then left to guess which route to take. 	0	1	0	0	1	0
252	I just went whatever way I felt like because the amounts change every time anyway.	0	0	1	0	0	1
253	tried to find destinations with good payouts	0	0	1	0	0	1
254	I tried to click as few as possible but I ended up not making very smart decisions	0	0	1	0	0	1
255	I first began by just choosing a path then clearing the rest of the board, however the penalties added up so I changed to first checking the end points of the plane until I found the best result.	1	0	0	0	1	0
256	Originally looking at every thing, after that just guessing, a few times i looked at the numbers in the first move only	0	1	0	0	0	1
258	i picked the between the initial four then I would branch from a positive node attempting to hit a 20 somewhere	1	0	0	0	0	1
260	I wanted to maximize my bonus without incurring too many payments for looking at the spaces. First, I uncovered all of the buttons to see the range of values. For the next several rounds, I just tried to find a fairly high positive value. By the last few rounds, I was aiming for a positive value above 20, and stopped uncovering new spaces when I found a route that would net more than $20.	0	0	1	0	1	0
261	I ended up taking guesses because I didn't know how much I would get with each move.	0	1	0	0	0	1
262	I winged it.	0	0	1	1	0	0
263	I have to be honest--I don;t get this game and was just hoping for the best.	0	0	1	0	0	1
264	I quickly looked for a circle with a positive amount in it	0	0	1	0	0	1
265	Planning didn't matter	0	0	1	1	0	0
266	Started with the first step, and if it was a positive number, pursued the next steps. If the complete route revealed seemed large enough, I did not both to reveal other routes.	1	0	0	0	0	1
268	I clicked on many of the dots to see how much they would cost.	1	0	0	0	1	0
269	Based on the amount at the two hubs	0	1	0	1	0	0
270	Whatever appeared to give me the most amount of money.	1	0	0	0	0	1
271	I found out what was the highest number at the beginnings of the routes, then the end, assuming that the numbers were identical, I then looked at the middle numbers as well.	1	0	0	0	1	0
272		0	1	0	1	0	0
273	how high the landing spot had	0	0	1	0	0	1
274	I tried to look for a path that led to the highest amount without spending a lot. If I found a green path I took it. 	1	0	0	0	0	1
275	I really went with my gut instinct and tried to determine the best route.	0	1	0	0	0	1
