,0,1,2,3,4,5,6,7,8
73,"If I saw both or possibly one of the end nodes on a path were negative, I wouldn't bother with that path.","I went for the ends looking for a $48 value first, then clicked the first or middle to see if there was a negative value on that path.","At the end nodes, most definitely.","Once I saw two positive values on a path ending with $48, usually. Once or twice I just gave up when I saw there were no $48 end nodes, and went for a safe-looking $24 ending path instead.","No, that about sums it up. End nodes first, first and/or middle nodes second or third, depending on how satisfied I felt about a path.","No, everything was perfectly clear.","How to optimize a strategy at this particular path-finding game, I guess.","Not really, no. But thank you for this opportunity.",32
74,"There was no reason to check the first two steps, so I didn't.",I only chose the end dots to maximize profit.,One of the end points.,When I uncovered a $48 I stopped.,I just tried to make the most profit.,No.,That there is no way anyone earned a $5 bonus.,Thank you!,28
75,I didn't click on the lower value nodes.,"I clicked on the largest potential value spaces, stopping when i got positive 48.","The outer nodes, specifically upper right.",Once I found a positive $48,"I would go until I found a positive 48, otherwise I would just pick a positive 24 if a 48 was not there.",No.,The strategy I devised was the suggested one.,No,21
76,I decided not to click on the inside nodes only unless there were two $48 or $24 nodes and then I had to click inside nodes to find the cheapest route to them.,"I clicked the outside to find the $48 node first, then clicked to find the highest paying route there.",I clicked the outside nodes at the beginning of each round.,I stopped clicking when I found the first $48 node,My only strategy was to find the $48 node then find the cheapest route to it.,Nothing was confusing or hard to understand.,"Thinking back to the exploratory nodes, I really should have paid to see if there were $48 nodes closer in. I just didn't ever run into any in the previous rounds so I saw no need to do that, but am curious if this would have helped.",None,44
77,if I found the 48 at the end,I clicked till I found the high of 48,yes,if I found the 48 at the end ,none,none,that it pays off to pay for hints,,27
78,"The training suggested I click the outer edges first, so that's where I started","Whenever I found 48, I just went there",Bottom left,When I found 48,Tried to minimize clicks to maximize profits. ,Not really,There is likely a logic to gathering this information that isn't intuitive to me,This was fun!,47
79,"When I hit a high positive value, I was done clicking",I just picked random end nodes,on the end nodes,When I hit a high positive value,nope,no,To be patient and look down the road for hints,,36
80,Just guessed,Just guessed,The end of a line,When I had no where else to go,Just hoped it was good,no,Be careful where you go,,28
81,It cost more money to see less results if you dont click the end of the web,I clicked on the last part of the web where the spider would end because it was cheaper in my opinion ,The end of the web,When I found the final value to be positive ,,No it was clear,Decision making skills,fun game,24
82,I tried not to click on nodes that had lost money in the past.,"I decided to click based on past experience, when a click did not usually lose money.",The left side.,When I was losing too much money.,No,I wasn't sure why I kept getting a delay penalty for poor planning.,I learned to try to pay more attention to past experience.,No,49
83,"when i started, i would click the ones immediately next to me, then I realized I was losing a lot of money clicking all those nodes.","I would click at the last node to see which one gave me the biggest amount (48) and then as soon as I uncovered the 48, I would take that route regardless of which node was before since the final node is what is worth the most.",last nodes,As soon as I hit the maximum amount.,,no,that the ultimate goal was the last node and all the numbers were the same just in - and positive form,,35
84,it was all random for me,just randomly,to the left side,when it wouldn't let me anymore,No,no,Nothing,,20
85,Once I found the pattern of how the numbers appear.,"After the first time, and seeing the entirety of the map and the patterns of payments.",The outer most edge.,Once I found the highest paying amount. ,,"Nope, this was actually really fun!",To think before acting.,,20
86,I skipped the first and second dots.,After a few rounds it became apparent to click on the last spot to determine the maximum payout,I spread it out but I guess I spent more time on the very right or left outside dots,When I found the maximum value,As soon as I found that +48 I went for it.,N/a,Nothing...,N/a,35
87,avoid going toward the negative values,"clicked at edge to find the highest points
then just toward that high point",arbitrary but at first where I last saw the highest numbers,when I got 48,"near the end, stop showing more nodes as soon as I saw a 48",no,to judge when I don't need more info and just continue,,48
88,If it took away money.,If it was worth money I went to it.,The top section in the corners.,After I found a positive sqaure.,Nothing.,no.,Patience ,no.,26
89,I didn't bother clicking on the first/second nodes because the values were small so as long as I got a big value on the final node it didn't really matter. ,"In the practice rounds I noticed that the outer nodes had the highest absolute value, so I clicked on those to figure out where the highest payout would be for the least investment of $1/click.","I varied it on purpose, but probably on the outer node on the top row since there was only one intermediate node versus on the left/right there were two intermediate steps. I assumed I would ""lose"" on the intermediate nodes and just factored this in as a cost to get to the +24/+48 node.",I stopped when I found the node that was worth +48.,I didn't really pay much attention to anything but the final nodes in each path. ,"I am not honestly sure what the ""first node"" range of values was because it didn't factor into my strategy so I never really clicked on them.",I learned to focus on the final value and not the intermediate steps.,"You misspelled ""comments."" ;)",39
90,Nodes,Guessing,top circle,Nodes,Luck and gambling,"At first, the nodes.",Probability,-,24
91,No preference or pattern.,It was totally random. I guess a lot of the time I would choose the right side.,"The right. It wasn't on purpose though, I think I just did it impulsively. ","Once I saw a green 4, I would stop. Otherwise, if I hit 2 reds, I would stop and go whatever direction I didn't click.",I usually went up when I went to the sides of the web (when I had the option to go up or down),"Yes, I was unsure of why the test round would have flashing red ""delay for poor planning"" warnings every time I clicked or moved an arrow key - but none of the other rounds had that?",Nothing,No,22
92,,,,,,,,,22
93,Not worth it to click the first 2 spots,Looking for the 48,An end point,Once I found the 48,Find the 48,No,Find the 48,,30
94,the first node,the outer nodes,on the last nodes. ,when i seen the green numbers pop up,click on the outer nodes to see if the trip was worth it before risking moving the spider to a bad node. ,no,the green numbers were constantly changing and the outer nodes had a higher value than the inner nodes. ,i wanna play again. i liked the game,25
95,Random,I just did at random,Random,Random,I honestly just went all out randomly ,No,Clicking more may have been better,,37
96,Getting the points at the end negated anything you would've lost in the middle nodes so I didn't really click those,The ends had the most money on them and negated the cost of clicking,The end nodes,When I found a 48 or uncovered all of the end nodes,Not really,Yeah it was confusing and annoying that I had to play a bunch of rounds that didn't count,Nothing really?,No,25
97,random,random,random,random,random,none,nothinig,none,30
98,I decided not to click if the last node ended in a negative value or a value less than another end node,I decided by seeing what the end values would be. ,i was most likely to click on the end nodes.,i decided when to stop clicking once i got to a positive 48 value by spending $1 to see the nodes.,no,no,I learned to always check the end nodes. i learned that spending $1 in the beginning saved me more money overall. ,,33
99,I didn't sweat the first two nodes as hitting the 48 mitigated any variation in them.,"I clicked the end nodes first, since they were the most impactful on total earnings.",Wherever my mouse pointer was naturally resting closest to.,Until I had either found a 48 value end node or exhausted all end nodes.,It was fairly simple.,No,That the end goal in this experiment is more meaningful than intermittent steps.,No,35
100,Did not click on first or second steps.,I randomly clicked the end spots.,Right or left extreme.,Once I found the 48.,I tried to change click order each time.,Not really.,Quickly learned clicking first and second steps not worth it.,No,46
101,I chose not to click on those with ending nodes which were negative.,"I started by doing it randomly, but then decided to start clicking on the last step nodes to see which led to the most at the end.",On the last level nodes to see which was the higher ending amount,"When I got to the highest possible ending amount or if I had already clicked a lot and they were all negative, I went with the first positive ",No,No,"I learned that it was more beneficial for me to see the ending amount, as they were all high enough (if positive) to cancel out the small amount of negative that I might get by not checking the 1st and 2nd levels.",,25
102,don't click on middle,"randomly, it didn't seem to matter`",end nodes of course,when i hit 48 or 24,"no, pretty simple","no, but it kept saying ""you shouljd click on a node"" when i already did",nothing...not sure what this was about `,n/a,31
103,I could not tell where not to click,I just tried different directions,up,after I decided which direction I was going,no,yes,I do not like spiders!,none,44
104,"by the last nodes, if negative, no point checking middle nodes","ilooked at the last steps, and then if there was uncertainty, clicked some others to find optimal path",any of the last nodes,if I saw a 48 I often stopped,tried to maximise profit.,n/a,optimal path choices,comments is misspelled,23
105,I did not pick the smaller first step boxes.,I randomly picked one of the last boxes in each path.,Top left circle which was the end of a path.,I stopped clicking when I found a spot that totaled $48,My only strategy was to follow the path that ended with the higher $48 payout.,no,I learned that it is better to spend a little to figure out the outcome than to take guesses and lose.,n/a,40
106,The opposite of where I had a bad run before,Gut feeling,The first node,When i found a good path,Just guessing,Nope,I'm bad at guessing,Nope,32
107,tried to avoid the bad spaces,i don't like clicking because it spends a dollar ,at the first step,when I was satisfied ,,no,"sometimes you win, sometimes you lose ",,29
108,I decided not to click so I didn't have to pay the $1.,"I typically didn't click, because I didn't want to pay the $1.","If I decided to click, there was no pattern of where I would click at the beginning.",I decided to stop clicking when I realized it was costing $1.,I didn't click because I didn't want to pay the $1.,Nothing was confusing.,I learned that this study was all about taking risks.,This was a very interesting study.,27
109,the red,"where the green was at, I wanted to click. ", higher corner pieces,when I found the highest number ,this was fun. I just wanted the high numbers. ,no,how to strategize,this was fuN! ,30
110,I calculated the path ,I used the node to help decide,the the left,When I seen the most positive path,I tried to notice a pattern but did not see on so I used the peek tool to help me,no,It would be real hard to get a 5 bonus,Thx for game,36
111,I eventually figured out that clicking on the end nodes was a better predictor of success than clicking on the closest nodes.,I eventually figured out that clicking on the end nodes was a better predictor of success than clicking on the closest nodes.,One of the end nodes,I stopped clicking once I uncovered a +48,,no,General problem-solving abilities,,47
112,I didn't need to know the middle just the end ones. ,Wanted to know what a few end results were. ,One ending node from each side. ,When I thought I would have an idea what was on the end of each of them. ,Nope. Just hope for the best. ,It was easy enough. ,That it's okay to spend a few dollars to make sure you get a positive number at the end. ,,34
113,once if found the big 48 did not need the others,start at the outside find the 48,right bottom ,when I found the big 48,"just get the big 48 the rest did not matter, not worth spending 1's to find a plus 4.",no,how to optimize the value of the circles,"that was fun, please post more hits!!",39
114,I did the trial,I did the trial,The ends,When i found 48,No,Nope,Strategy!,Thanks!,30
115,Paths that would be hit on my way to the +48 didn't matter.,"The outer nodes told me where the +48 was, and I favored the previous location of the +48.",The previous landing spot.,As soon as I ran into the +48 or ran out of outer nodes.,That's it.,No,About picking the best path quickly,,29
116,I didn't really know where NOT to click,I clicked on where the blue dots were highlighted,One of the outer corners,Once the game stopped me,I only clicked on the corners first,no,To wait a while before clicking,No,37
117,The practice test helped me figure out that clicking on the end nodes was most important. So I knew not to click on the closer in nodes if I knew the end node path I wanted to take.,I used the practice test to help. ,An end node.,"If I saw a path to a +48 at the end, I would stop clicking and just go along that path.","I tried to minimize losing the $1 for clicking, but I quickly saw I would lose big if I didn't click enough to get to a good end node.",No,"I learned to click on end nodes, most importantly.",,36
118,I chose at random,I chose at random,up,I waited until the time ran,np,no,I think it was random ,,29
119,Nothing unnecessary like the first and second spaces which didn't make much of a difference in earnings,I chose the destination spaces and kind of randomly chose until I found 48,Top left,When I found 48 or all the end nodes were viewed,Just kind searched for 48 and didnt pay attention to the first couple nodes.,It was easy.,Nothing as far as I can tell. ,Thank you!,34
120,I didn't click on paths that lead to -48 or -24,I tried to be systematic about revealing the best outcome.,the upper right corner.,I stopped when I found the +48,I wasn't sure about checking the second node from the end if there seemed to be two equally good possibilities.,no,I learned how to optimize my strategy for this particular puzzle.,no,32
121,"I tried to maximize my clicks, so I went with the highest value first.",I looked at the highest values first and then went down the tree if I had to.,The bottom left.,When I got a 48.,I tried to balance the cost of clicking with taking a risk.,No.,I learned not to over-click.,,31
122,"The middle nodes were useless, so I wouldn't click there.",I would click on the last node to try and find the most reward.,Top right node.,When I found the +48 I would stop.,Just dig until you find the 48,"No, nothing confusing.","That not all spiders are bad, but I will still murder the buggers in my house.",,31
123,I didn't click on the first steps because it's not worth the $1.,I clicked on the edges until I found a + $48.,The last destinations on each branch.,I stopped clicking when I got a + $48.,I tried always went to the highest final amount.,It was easy to understand.,I learned to find out what the amount was at the final point and not worry about what was on the path.,,36
124,non extreme points,extreme points,"sometimes the last max, but any extreme pt.","when I reached 48, or even 24",nope,nope,minus a couple of $$ is ok for +48,,74
125,-,Random click until I found the green 48.,Bottom left outer bubble and then around the outside.,Found the green 48,Nothing of note.,At first I was confused about getting the time penalties in the practice round.,I learned that If i click the link t o open the game a second time accidentally it will reset my game to the beginning and I will have to start all over making less money the second time!,,33
126,"I didn't want to waste clicks on the smaller value nodes, so I mostly clicked on the ending nodes.",I went for the +48. ,The ending nodes.,When I felt my choice was correct. ,No.,No,Patience and thoughtfulness,No,39
127,"I decided that for the most part, if I found the green 48, I'd just go straight to it because it would be likely to be the most money even if I found a full ""green"" path to a 24.","At first I was playing to see a good ""green"" path, until the training model had me click the outer nodules first, which made more sense. So I started to do that. ",The outlier nodules.,Once I found the 48 in most cases.,Which ones on the outside to click first was random.,"The training module kept telling me it would have been better to take the action that I had just taken, that was confusing.",How to approach problems like these.,,36
128,The closest because they were worth the least,The last nodes because they were worth the most,The last nodes,When I found the best node,I clicked the most expensive nodes because they were most important.,No,I learned basic strategy thinking,,18
129,Tried not to click anywhere that wouldn't take me to a 48,Outer nodes first looking for 48.  Then the best path to the 48,Outer nodes,When I had the clearest path with highest score to a 48,"I would just look for a 48 and click until I found them on each path, then I would try to find cheapest way to get there",no,"That outer nodes had a max of 48, inner nodes had max of 8",NA,39
130,"if i found a 48 node, i stopped clicking",looking for the 48 nodes,"the last level, looking for 48",when i found a 48,"once i found the 48, i would stop clicking to save the click fees and go to it.  worst case, i would still get at least 36.",not really.,"it was fun, learned that its not important to know all the values if you can still find a path to a good total.",fun game!,29
131,On the inner and middle circles.,On the outer circles until a 48 appeared.,Bottom left.,When a 48 appeared.,I clicked outside circles until I got to a 48.,No.,That the outer circles were what counted most.,Good luck with your study.,49
132,The middle tiles were unimportant to know about.,"After I discovered I could click on more than just the first tiles, I clicked on the last ones first to see the final amount.",Any of the final tiles were first for me to click on.,If I found a $48 I would mostly just head in that direction.,Sometimes I'd click on the first ones to see if some were better than others.,No.,"I learned after the first practice round I was able to click on any tile, not just adjacent ones.",NA,29
133,random decisions,random decisions,to the right,the end of options,no,no,pay more attention to what I am clicking,,47
134,Just did not click on the interior,"Just went with my feelings, and always clicked the nodes on the outside, and if I got a 48 I stopped",A random one on the outside,When I saw a 24 or 48,Just tried to vary my guesses,nope,That 48 is the most you can get on one of the outside nodes,,37
135,I did not click on the beginning nodes since they were only worth a small amount,I always clicked on the end nodes since they had the largest values.,The top node on the left ,If I found the $48 ,I think it was efficient to click on the end nodes since they had the highest value,Everything was clear,The large values entice me more than the small values. It also might have been worth it to click more often and spend the dollar,It was actually enjoyable,23
136,"If the last or end nodes are either both negative or one negative, I will not click on that side but focus where there are positive end nodes.",Based on finding out the value of the very end/last nodes. They have to be the highest. If there are 2 or more equal high values then click on the inner nodes of each value to see which has a positive value.,One each set of the very last or end nodes,"When after clicking from outer to inner nodes and reasonably determine which one has a higher gain value and lower lost value,","After determining which has positive end node values, if the highest unique value is 48, I will move towards that. If there are equally high values(i.e two or more 48s or 24s), I will click on each node connected to those positive end values to determine which is positive or negative. If I still can't determine which one was has a higher gain, lower lost, I will click on each node after that one. Then I will move towards the one with the highest gain and lowest lost.",No,Determining highest gain and lowest loss,Neat,30
137,I did not click on steps that I did not plan on going to.,I clicked the outer steps until I uncovered 48.,The top left step.,When I saw 48.,Avoid -24 and -48.,No,I learned how to play 'Web of Cash',Fun!,20
138,where i was sure there would be a negative number,i clicked on the end nodes where the spider would land; the last ones at the end of the web,on the side nodes at the end of the web,when i got a high enough positive number that was satisfactory,no,no,how to strategically make decisions based on directions,,20
139,Inner nodes weren't worth it because a +2 is easily cancelled out by -24,Outer nodes to see what the highest values were,Picked an outer node at random,When i saw +$48,"Once it seemed like the outside had the biggest pos or neg, I only looked at the outside because I knew I could do all 6 clicks and hit negatives on the inner nodes and still come out positive with a +48",I didn't understand how the poor planning delay worked ,It's important to consider final outcome vs immediate outcomes in determining which plan is best,,31
140,There was somewhat of a pattern of negatives. I did click and lost dollar each time.,I mostly used a dollar to click where I wanted to go,Left bottom side is where I mostly clicked.,When I finally clicked a positive spot.,"No, I think I explained everything.",It was easy to understand,How to plan where to click,none,34
141,I decided based on whether or not I had already found a high point target and whether it was likely or not that the node contain a high enough point score.,I decided based on the highest value possible for that certain node based on it location.,The set of nodes that contains the highest point possible.,I stopped clicking once I had found a 48 point node or until I had exhaust all the possible node that could contain that high of a score. ,"Once I had found the highest point node, I moved toward it to end the round, else, I continue to click until I had found it or settle with the next highest.",No.,Nothing in particular.,,29
142,guessed,guessed,top left,when I found $48,random,no,don't know,no,35
143,When I didn't need to know what was there because it was trivial.,"I clicked the end results, all of them.",The end of the node paths.,When I had a path to take.,Figure out which end node gives the most money and work back from there.,Nope,7 second patience.,None,33
144,I stay away from the -48. I used the 1 point to reveal.,I went toward the +48. I used the 1 point to reveal.,Top corners.,When the +48 popped up,I just pay the 1 point to reveal where +48 was.,No,I'm not sure. ,,31
145,If one of the outside nodes was more than all the rest,"Looked at the outside nodes first (always), when two nodes matched, looked at their paths to find the least expensive path",Left top corner,When I was convinced I had the best path,No,"During the training, the suggestions didn't take my choices into account. For example if I picked a corner node, the suggestion said I should have picked it and even if I picked an arrow key, it would tell me to do that. ",How to optimize my route to find the best path,See above,25
146,THE FIRST 2 STEPS WERE ALWYS BELOW 10 VALUE SO NOT WORTH CLICKING,REVEALED THE LAST SPOTS,LAST SPOT ON THE LEFT,ONCE I FOUND HIGHEST POSITIVE,IF THERE WERE MULTIPLE HIGH THEN I CLICKED THE NEXT NODE TO DECIDE WHICH HIGH I WOULD GO FOR,NO,NOTHING. ,WOULD HAVE REVEALED LESS NODES,34
147,Avoided what did not work previously,Same direction that was rewarded previously.,to the left,When a relatively high amount was reached,quit when you are ahead.,The delay penalty ,To click wisely and stop when you are ahead.,"A very interesting game, I enjoyed it but did not thoroughly understand it.",70
148,Where there were large negative amounts.,Wherever the end result was the highest.,On an end node.,When I saw a high end number.,,"Not sure if I answered the questions right after the game right. I was concentrating on the end numbers and didn't really pay attention to the small numbers, and also forgot about the ratio of bonus payout.",To look at the end result first.,,46
149,i click all nodes,by looking at node money,the first node,when i see the node with highest payout ,nothing,nope,to go with the most highest node ,nope,27
150,"I didn't click the closest nodes, as what I would gain or lose was insignificant compared to the furthest nodes.","I clicked the last nodes to find the highest value, as it made up for the earlier nodes.",The last nodes.,When I found +48,"No, I think I described it well enough in the previous answers.",No,I learned that positive outcomes could offset negative ones.,,22
