,0,1,2,3,4,5,6,7,8
0,"If I had all end points clicked already, there wasn't much of a point to clicking the ones close to the middle unless I uncovered 2 with 48 points.",I figured the amounts would shuffle with each round so I tried to click different nodes first in each round.,The end points (corners),When I found 1 or both with a value of 48,Just hoped for the best.,No.,I learned that it's not as easy as it sounds.,I did have to restart the survey 1 time because one of the pages  would not load. It sailed right through this time. Thank you.,45
1,no negative 48 nodes,I tried to figure out which node ended in the highest value,the ends of each node line,when I found the positive 48,,no,Sometimes there wasn't a postive 48 node at all,,33
2,I used the click to select the nodes at the corners and if it was green I went to the,I used the click to select the nodes at the corners and if it was green I went to the,in the corners,when I saw at least the value of 24,No nothing special,no,to make decisions without so much information,"I think that there is no way to get 5 usd bonus, then they should not put that value, it seems a little cheating",26
3,"If the dollar amount of the last node was negative, I did not go that route.",I decided where to click based on the dollar amount of the last node.,I was more likely to click on the node that would lead to me going a shorter route.,I stopped clicking when I get a favorable amount.,,It was not confusing but it was hard to understand. I did not realize that I could reveal the amount under all the nodes.,I didn't learn anything from this experiment.,Fun experiment.,29
4,I looked for the nodes with negative dollar amounts at the end of the web.,I clicked the nodes at the end to determine where to click. ,One of the nodes at the end,When I found the green $48 node at the end of the web.,I continued clicking the nodes at the end of the web until I found one worth $48,I was originally under the impression that I could only click one node per round. ,Training block. ,This was a fun task. I look forward to doing more,33
5,the ones near the center did not matter,The last node you could end on,An outer most node,When I found a big dollar amount,no,no,I clicked enough to be sure,NA,55
6,First or second level node.,Third level node. ,Third-level node.,After revealing a third-level node.,"No other strategy, it seemed random. ",No.,That the game is mostly random.,Waiting several seconds between clicks and movements disrupted flow. ,35
7,tried to stay away from the red,just random ,right ,random more less,,no,noting,,34
8,I decide NOT to choose the path when the node is negative LOLz,"I click the edge of the last nodes and decide choose the path if it is the highest ( +48) right away, if it is (+24) I wait and see if there is higher nodes",I was most likely to click the last nodes to see rather it is positive and if it is the highest nodes. ,"I decide to stop clicking when the edge of the nodes are all clicked because sometimes they follow a pattern, the opposite side is it's positive, but sometimes the opposite is not the same. ","1) I click on the last nodes
2) I choose the highest positive numerical value
3) If it is tie, I click on the first and second nodes to see if the numbers added together are higher than if choosing the other path. 
4) I think pick the side that gives me the highest positive net worth ","Nothing was confusing except during practice, I didn't click $1 at first, but during the trial I did realize to use the niffy clue. ",I learn best to confirm last nodes as other chances to get higher numerical value. ,Pretty fun. ,20
9,I always inspected the end of the path.,By spending to reveal the nodes.,At the end of one of the nodes.,When I found the highest value.,It was better to spend to reveal than not to.,No.,Interesting way of gambling.,Fun game.,31
10,I did not click on the first and second nodes because the money they added or subtracted was small. ,I clicked on the last nodes because the last nodes gave the most money.,I tend to click on the on the last node on the left side of the web and from there went clockwise.,"I stopped clicking after I found a green 48, if it did not appear I would choose  the  next highest, green 24. ",I don't have any else to describe about my strategy. ,I thought it was easy to understand. ,I don't think I learn anything. ,,31
11,If i already had a node discovered that was on the outside I would generally stop clicking,I clicked on the outside nodes to determine the best path,The outer nodes,When I knew I would only lose money if I continued clicking,,no,That I enjoy HITs that are games,,26
12,"I did not want to spend money clicking on the nodes between the beginning node and the ending node, because the gains/losses of those nodes were insignificant compared to the ending nodes.","I specifically focused on the end nodes, as they granted the highest gains/losses. I wanted to make sure that I ended the round with the highest possible gain.","I was most likely to start clicking at the end node in the bottom-left corner, and move in a clockwise fashion around the web.","I stopped clicking as soon as I revealed the number ""48"" on the end node, as it is the highest possible gain.",I basically began each round with the end in mind. The gains/losses between the beginning and end node were insignificant compared to the larger values of the end node. Any losses obtained along the way would've been offset by the large gain provided by the ending node.,"The instructions were fairly easy to follow. Having the trial runs definitely helped bolster my understanding of the game mechanics, because it certainly took a few tries for the details to sink in. It was kind of like learning how to ride a bike - there's some trouble at first, but practice makes perfect.","By playing this game, I learned that you have to sometimes spend money in order to make money. Aimlessly navigating the web without spending the money to reveal the nodes was a certain way to lose money. In a manner of speaking, it is like a return on an investment.",This was a really fun and interesting game. Thank you for the opportunity to participate!,29
13,If I had a 48 revealed there was no point in clicking the other branching path.,I wanted to find the 48s first and then I would see what path had the most points.,At the end of the paths.,When I knew I had the best path for a 48.,If I found a 48 the other path didn't matter. The only button that mattered would be the previous buttons before any 48s that I revealed in order to get the most points.,I was confused about the correct strategy at first.,I learned to eliminate other possibilities bases on the information I already had.,This was fun!,25
14,i tried not to click on the closets ones to myself,i learned to click on all the end nodes,randomly on one of the end nodes,when i found the 48,there was nothing else.,no.,to strategize based on where i knew i might find the largest number.,none,30
15,"once the furthest nodes have negative amounts, i don't click on the intermediate ones that will lead to that route",based on the nodes that have the highest values (outermost),the outermost nodes,"once I see the max 48 on a node, I decide on that route and don't bother testing other routes even if it could mean another route with a slightly better payout","once I see the max 48 on an node I don't bother to test other routes for a slightly bigger payout, and just go with that max 48 route as testing other routes could lead to lower payout too. not worth the slightly higher payout.",no,"I am willing to lose a little money for a bigger payout, but I am not willing to lose a little money when I already know I have a decently large payout, even if it means a slightly higher payout.",,33
16,There was no reason not to click on anything other than the last nodes.,"I only clicked on the last nodes, because they were the true deciders of a profitable round or not.",randomly on the last nodes.,"When i found a +48, or until i knew there wasnt a +48 to be had.","Using a dollar to make 4 isnt worth it, but using one to make 24-48 is.",No,Efficiency.,"Didn't the study say it was possible to make $5 bonus?
That seems... unlikely.",24
17,I avoided negative node areas ,I inspected every end-node until I found one with the max positive value,I started my inspections from the top left node then went clockwise  ,Once a found a node with the max value of points,I just used the same strategy that the practice round taught me. It really helped me understand how to use the inspection tool to find the best route. I would have done poorly if I did not follow the practice round advice.,no,I learned to use logic better in understanding where to guide my spider than what my original idea was.,I liked this HIT,31
18,GUT INSTINCT.,GUT INSTINCT.,TOP,GUT INSTINCT.,JUST A HUNCH.,NO.,TO BE MORE CAUTIOUS.,IT WAS FUN. I LIKE TO PLAY AGAIN I FEEL I WOULD DO BETTER.,51
19,pattern,random,left,I didnt,,no,about a greed,,41
20,if I had already revealed the highest ammount,by learning that I need to look at the last node,the top right last node,when I revealed the highest ammount,no,no,to look at the end for a result,no,43
21,i didn't click on any other part because it was irrelevant,"i would only click on the furthest away spots, because this was where the $48 reward was, which was the highest prize",The furthest away part,when I found the $48 prize,"Find the 48 by clicking, stop clicking and go to the 48",I didn't understand the delay for poor planning in the second part,The setbacks from penalties are worth it if there is a bigger prize at the end,,23
22,least expensive ones,expensive nodes first,farthest node,i clicked until i got +48,,,,,35
23,The first and second nodes were smaller values and had a smaller impact on the final earnings for the round.,Went to the furthest nodes as any negative amounts incurred along the way would be offset by any +48,Outer node.,When I revealed a +48 or a +24 if I had clicked many nodes before I figured out the optimal strategy.,It took me longer to figure out the optimal strategy than I would have liked. It seems obvious now.,No. ,Learned to consider my strategy more carefully rather than random clicking.,,39
24,"Again, I used my intuition. ",I basically used my intuition which did not prove to be any good. ,To the right. ,Once I got to the end then obviously there was no where else to go. ,"I tried to use reasoning, intuition and my experiences form the previous rounds to make decisions. ","No, the game was pretty simple. ",I learned that my intuition was not working too well today lol. ,thank you! this was fun! ,35
25,I kind of didn't make a choice about this aspect.,By choosing the spots that I felt offered the most return.,I kind of chose randomly.,Once I found a spot that was offering $48 or if the highest amount available was $24.,"No, that's about all there was to it.",No,I'm not really sure what I learned in particular. I'd have to be asked a more specific question.,This was really interesting and fun. Thanks! ,37
26,guess,guess,"max value node, right side mostly",reached more value,good game,no,guessing node,good game,32
27,If the number was minus,To try to find the biggest payout number,on the outside nodes,when I found 48,no,no,that it paid to spend the dollar to know what value the node had.,none,50
28,Using the node inspector to start out and determine the best route to go.,Guessed and tried to find patterns,With the node inspector to see what the best route might be.,Got to the end of a path,Mostly used the node instructor to get started on the best route and then from there was kind of a guessing game.,No,There may have been a better strategy.,,48
29,I didn't really concentrate on the first nodes a lot because it wasn't worth losing a dollar. ,"Clicking was sort of random. I figured that if I was successful in one spot before, I probably wouldn't be successful in that same spot. I clicked on the last nodes first and if I got a value of 48, I knew that I should move to the node to maximize my earnings. ","At the beginning of each round, I clicked the last nodes first.","When I got a value of 48 on the last node, I knew that I should move to the that one to maximize my earnings. So, I eventually stopped clicking other places.","Not really, other than the fact that I tried to be random when deciding which of the last nodes I should click.","No, the instructions were very clear and easy to follow. The practice rounds were also helpful","I think the task was great at helping me outweigh my outcomes, strategize and take risks. I'm usually not a risk taker but this was fun to do.",This is probably the best game-based survey I've taken on Mturk. Great job!,26
30,what clicking?? i had to wait 42 seconds between each click !!!,"i clicked willy nilly. the learning stage was SOOOOOO defective, i learned NOTHING AT ALL",anywhre i could,i had a choice? i got 3 clicks then nothing,move when the program let me,"yes, i was confused as to why i just spent 17:48 on this stupidity",absolutely nothing,i feel cheated out of almost 20 minutes of my life,51
31,I SAW THE RED,I TRIED CLIKCING NODES,END NOTED,FINAL ANSWERS, CLICKED ON MY BEST CHSACES ,NO,TO CLICK ON CERTIAN ONES,NO,29
32,I quickly realized that it wasn't worth clicking any of the steps close to you because landing on a -$24 or -$48 at the end would just wipe it all out anyway.,There was the most value in clicking the last steps to look for 24 or 48 positive points.,The last steps in all the different directions.,I would usually stop clicking once I found a $48 square.,"I think clicking the last steps, looking for a $48 square (or at least $24) and then going in that direction pretty much sums it up.","No, it was clear and easy to understand.",In the game the space you end up on is much more important than the spaces you take to get there.,"Fun hit, thank you.",31
33,"I tried to do whatever I didn't do last time, since I was not good at this game.",I tried to figure out a pattern.,I tended to go up the most.,When it was over.,Obviously I didn't have a good one.,,nothing,,47
34,if the last node was negative,i clicked the final nodes first,,when i found a green 48,,,,,33
35,away from the red negatives,Guessing game ,middle ,when the numbers were too high,no ,no ,the game,no ,29 
36,"I only tried not clicking nodes once, I was experimenting to see if I did about as well as I did when I revealed the nodes. I felt like I did more poorly when I didn't click the nodes.",I clicked all of the first nodes.,I clicked all of the nodes.,Most of the time I revealed all of the nodes.,That's pretty much it. I guessed the whole time.,No.,"I learned that I should be a strategist or a gambler, haha!",Nope.,33
37,"If two red numbers were revealed at the end of a node, I did not bother clicking the nodes closer to the spider.","After the training block, it was clear that good planning involved clicking on the further away nodes first. When a green 48 was revealed, I often did not click any more nodes.",Bottom left node,When I could maximize the amount I earned without having to waste clicks to uncover less lucrative routes.,"Minimize clicks, try to find the green 48. When a green 48 is found, go to it, only click the nodes on it's path if a 2nd green 48 is found. Choose the more lucrative path in this situation.",I did not expect to be penalized for poor planning in the training block. I did not understand what was considered good/poor planning until the 8th block or so.,"Poor planning involves evaluating the short term outcomes. When evaluating long term outcomes, the outcomes in the short term can often be disregarded, or at least mitigated.","The 42 second penalty for poor planning was severe and in my opinion, disrespectful to me as a participant. That is too steep a penalty for this task. Please reconsider.",29
38,"If the end of the node ad a negative number, I avoided those areas.",I tried clicking on random places then realized I should only click the ends to minimize my clicks.,"I started clicking right next to the spider to begin. After I learned a batter strategy, I started clicking on the ends only.","If I saw a 48, I stopped clicking.",,Nothing was confusing.,I learned that strategy is important.,Fun game!,30
39,"wherever the -48 where at, i avoided",whereever the 48$ ends wheere ,the ones with the most money ,whenever i found the 48 ,avoid negatives ,no ,you win some you lose some ,n/a,21 
40,I did not click on any first or second nodes as the values on those were relatively insignificant to my final score.,I clicked on the final nodes looking for the $48,"Any given final node, I did not really follow a pattern with which one.","Once I found the positive $48, I stopped.",I was simply trying to get to the +$48,No,"To focus on getting to the largest, positive final node.",N/A,24
41,I only clicked on paths leading to big rewards.,"I clicked the outside first to find out where the big rewards were, then worked my way in.",On the outside bottom corner.,Once I had found a decent enough reward.,I clicked more than I needed to because it only cost a dollar.,"At first when I was being penalized I was confused as to why, but I figured it out pretty easily.",I learned the best technique to make the most out of this game. I also learned to do more HITS from y'all.,It was fun! Thanks!,25
42,The first few were lower values so not as worth it,It seemed the last value you ended up on was always the largest so I would click at the ends to determine where I would end up,the ends of the Ts on each side,When I found a plus 48,Nope - pretty simple,No,That it was worth giving up a few dollars to have more in the end,No,25
43,I never clicked on the first node.,"I would do the end nodes first. If any of them had 48, I would go there. If two had 48, I would do the second to last node.",the end nodes,If I had a 48 OR if I had 2 48s and the second node was larger in one node,"If one group of end nodes had one 48, I wouldn't click on the other",Nope,A strategy for evaluating paths,The training session was annoying and made me needlessly wait 3+ seconds to display the same dialog box over and over again,24
44,"Clicking on the inside wasn't usually important, unless there was more than one 48.","I clicked on the outside, generally on all of them to see where the 48 was.",I was most likely to click any of the outside at random.,I decided to stop clicking when I determined it wouldn't make as much of a difference in choosing which lane I went down.,My strategy was all about maximizing the opportunity to get the 48 since that would make the dollar cost to click as irrelevant as possible.,No.,I learned how much I'm willing to spend to get the highest prize.,N/a,30
45,"Not where the cost of clicking would not have made an impact, the first two steps.","At the end of the line, where to financial impact was greatest.",Wherever I felt like the placement of the +48 route would be.,When I found a stop that was a +48 or all endings had been explored.,"I'd relied much on luck, I suppose it could have gone much worse.",No,Sometimes you have to spend money to make money.,,18
46,just change,just chance,a corner,after I found some green,nothing really,no,I found no plan,na,45
47,bad payer previously,tried to find a good payer and milk it out. ,right,when the spider stopped,not too good!,nothing,"stay away from spiders!  No, I learned to keep trying new routes",,65
48,where the endpoints were -24 or -48,"i clicked the goal points to find the highest value, and proceeded on that path",the end points,when i found a +48 endpoint,"find a +48 endpoint and stop clicking, just follow that path",nothing,A small investment helps get bigger returns,none,31
49,once the largest ultimate node of 48 was found no other nodes mattered.,"at first, on all nodes to see their value, finally at the last nodes to see ultimate value.",the final nodes starting with the bottom left hand-side of the web.,when the largest value node was found.,click as few nodes as possible to defer inspection costs.,,only one 48 nodes was present on each web.,,29
50,Any space that wasn't the last,I picked the last one first to ensure the largest payout,The last node,When I found the +$48 node,N/A,N/A,Last nodes have greatest payout,N/A,18
51,"The inner areas made the least amount, I stayed away from them. ",The outer edges seemed to be where the money was made.  I based in on how much was earned in that spot in the previous round. ,the upper edge. ,When I saw what seemed to be the maximum amount I could earn. ,No,No. ,How to determine the most money I could make. ,No. ,42
52,Revealing the final nodes.,I revealed all the final ones.,Last nodes.,"When I either revealed all the final nodes for the best, or 48 dollars.",Last nodes were the big money.,no,Last nodes were the big money,no.,27
53,by a guess,i was by a little guess,by guess,by a guess,yeah i used a small stratergy,no,i learned about the luck,none,46
54,the end node of a negative value,The end node value of 24 or 48,near the last round node,the value of 48,no,no,strategy,no,49
55,just guesed,just guessed,just guessed,just guessed,no,no,na,,59
56,"If there was no point in clicking. If I had already found a +48, or if both end nodes were negative.",The end values first so I would know the largest amounts,One of the end nodes.,When I found an acceptable end balance.,No,No,The strategy to get the most money,none,36
57,random,random,right then left,after 3 clicks,no strategy,no,nothing,,58
58,"Same thing, I didn't really have a plan going in. I just randomly picked a direction",It was just a random click. I didn't put any real thought process into it,I think I clicked left or right more often.,When the game was over,I didn't have a strategy. ,I may have done it incorrectly. I'm not sure,That I didn't qualify for a bonus because of bad clicking choices I made.,It was a great game. I truly enjoyed it. Thank You for the opportunity,46
59,The first two holes,The last hole and see where the 48 is,The last node and hope I hit a 48,Whenever I see a 48 I go there,"No , just hope i see a 48 and then i go there",It made sense after I understood it,How to play the game,Good HIT,25
60,If it was probably going to be a losing path,The path that would probably lead to the highest points,To the left,When I found the most profitable path,,No,To quickly find the profitable path.,,55
61,randomly,i just chose randomly,it was random,when i saw 48 usually,it was mostly random,no,nothing,,23
62,the value of ending node,depends on the value of ending node,I didn't have a method for that,once I found the highest value,,no,take chances,,38
63,I didn't choose inevitable moves,I chose the furthest out,The outer nodes,Whenever I got stressed ,Sometimes I thought 24 was good enough and I wouldn't waste clicking all the nodes,Nope,There is strategy to this,Thanks!,25
64,I guessed.,I guessed.....,The last spot of any give direction.,"If I hit a positive 48, I did not click on anything else.",No,No,How to strategically earn the most by navigating the web.,None,45
65,Clicking on the first two nodes on any path would not have told me much about which node was my goal.,"The very last nodes always had the highest (or lowest) payout, so I wanted to see what my goal was.",Any of the outermost nodes.,"When I saw a positive 48, I stopped clicking and took the path to it. Even if there were another positive 48, I didn't want to waste clicks when there may not be much of a difference in payout.",I tried to minimize clicks and maximize payout.,No.,"It's best to figure out the goal first, then determine the best path towards it.",,24
66,I didn't want to waste clicks on the near nodes since they weren't worth mich,The furthest nodes were worth the most so I clicked those,I tried to mix it up,when I found the 48,the 48 would appear in the same spot 3x in a row,no,cliking on the furthest nodes made the most sense,thank you!,50
67,The end results was a negative.,At the end results because I wanted the highest number regardless how many negatives where on the way to get there.,An ending nodule.,When I found 48 I knew I would find nothing higher.,Crossing fingers.,"No, though it took me awhile in the training to figure out exactly what I was doing wrong.",Based on the rules for this game it was worth spending the $1 to find the highest nodule.,"No, it was a fun game.",35
68,Do not click anywhere that does not lead to highest final valuation,Final destination is most variable in valuation,Next step,whenever I found a +48,"I felt the opportunity cost of scanning each spot was too high, so I just scanned until I found either a 48 or next highest which was 24. If only two 24s were available, I considered scanning the next best option, which after playing seems like a better option, but I was only put in that situation twice.",No,This game suggests having a goal and spending resources in making sure you are on track is a good strategy,,31
69,I didn't bother with the in between steps as they were negligible,"If the destination was 48, I just went there.",left upper node,when I found a 48,,no,That it's easy to forget how much little deductions can stack up,,27
70,NOT BAD,GUESSING,GOOD,GUESSING,MASTER MIND,YES,GOOD,GOOD SURVEY TO TAKE EVERYONE,28
71,"If i chose a module and it had a high negative number, I wouldn't go that way.",Randomly,The corners.,When I saw a high green number. ,No,No,Nothing,None,38
72,It's are dangerous,I have decide puzzle style,every step you can give most values in dollars,It come from negative points,I think person decision making in some situations,Nothing,Lot of try,Nice task to do ,32
